[
  {
    "question_id": "SYN-Q01",
    "intent_id": "FIX-INTENT-01",
    "leakage_group_id": "FIX-GROUP-01",
    "language": "de",
    "text": "Wie heißt SYN-1 im synthetischen Datensatz?",
    "category": "lookup",
    "difficulty": "easy",
    "critical": false,
    "split": "TRAIN",
    "origin": "synthetic_fixture"
  },
  {
    "question_id": "SYN-Q02",
    "intent_id": "FIX-INTENT-02",
    "leakage_group_id": "FIX-GROUP-02",
    "language": "de",
    "text": "Welche Jahre sind für SYN-3 erfasst?",
    "category": "lookup",
    "difficulty": "medium",
    "critical": false,
    "split": "TRAIN",
    "origin": "synthetic_fixture"
  },
  {
    "question_id": "SYN-Q03",
    "intent_id": "FIX-INTENT-03",
    "leakage_group_id": "FIX-GROUP-03",
    "language": "de",
    "text": "Welche Zustände sind für SYN-2 im Jahr 2021 erfasst?",
    "category": "lookup",
    "difficulty": "medium",
    "critical": false,
    "split": "TEST",
    "origin": "synthetic_fixture"
  },
  {
    "question_id": "SYN-Q04",
    "intent_id": "FIX-INTENT-04",
    "leakage_group_id": "FIX-GROUP-04",
    "language": "de",
    "text": "Welche Veranstaltung wurde 2023 begonnen und abnormal beendet?",
    "category": "lookup",
    "difficulty": "medium",
    "critical": false,
    "split": "HOLDOUT",
    "origin": "synthetic_fixture"
  },
  {
    "question_id": "SYN-Q05",
    "intent_id": "FIX-INTENT-05",
    "leakage_group_id": "FIX-GROUP-05",
    "language": "de",
    "text": "Wie viele Ereignisjahre enthält die gesamte synthetische Tabelle?",
    "category": "aggregation",
    "difficulty": "easy",
    "critical": false,
    "split": "TRAIN",
    "origin": "synthetic_fixture"
  },
  {
    "question_id": "SYN-Q06",
    "intent_id": "FIX-INTENT-06",
    "leakage_group_id": "FIX-GROUP-06",
    "language": "de",
    "text": "Wie viele verschiedene Identitäten enthält jede Landesgruppe?",
    "category": "aggregation",
    "difficulty": "medium",
    "critical": false,
    "split": "TRAIN",
    "origin": "synthetic_fixture"
  },
  {
    "question_id": "SYN-Q07",
    "intent_id": "FIX-INTENT-07",
    "leakage_group_id": "FIX-GROUP-07",
    "language": "de",
    "text": "Wie viele gelistete Beobachtungen enthält jedes Jahr?",
    "category": "aggregation",
    "difficulty": "medium",
    "critical": false,
    "split": "TEST",
    "origin": "synthetic_fixture"
  },
  {
    "question_id": "SYN-Q08",
    "intent_id": "FIX-INTENT-08",
    "leakage_group_id": "FIX-GROUP-08",
    "language": "de",
    "text": "Welche Landesgruppen haben insgesamt mehr als fünf Ereignisjahre?",
    "category": "aggregation",
    "difficulty": "medium",
    "critical": false,
    "split": "HOLDOUT",
    "origin": "synthetic_fixture"
  },
  {
    "question_id": "SYN-Q09",
    "intent_id": "FIX-INTENT-09",
    "leakage_group_id": "FIX-GROUP-09",
    "language": "de",
    "text": "Wie ändert sich die Zahl erfasster Beobachtungen von 2021 zu 2022?",
    "category": "temporal",
    "difficulty": "easy",
    "critical": false,
    "split": "TRAIN",
    "origin": "synthetic_fixture"
  },
  {
    "question_id": "SYN-Q10",
    "intent_id": "FIX-INTENT-10",
    "leakage_group_id": "FIX-GROUP-10",
    "language": "de",
    "text": "In welchen Jahren ist SYN-1 nachweislich durchgeführt?",
    "category": "temporal",
    "difficulty": "medium",
    "critical": false,
    "split": "TRAIN",
    "origin": "synthetic_fixture"
  },
  {
    "question_id": "SYN-Q11",
    "intent_id": "FIX-INTENT-11",
    "leakage_group_id": "FIX-GROUP-11",
    "language": "de",
    "text": "Welche Identitäten sind 2021 und 2023 im Datensatz enthalten?",
    "category": "temporal",
    "difficulty": "medium",
    "critical": false,
    "split": "TEST",
    "origin": "synthetic_fixture"
  },
  {
    "question_id": "SYN-Q12",
    "intent_id": "FIX-INTENT-12",
    "leakage_group_id": "FIX-GROUP-12",
    "language": "de",
    "text": "Welches früheste und späteste erfasste Jahr hat jede Identität?",
    "category": "temporal",
    "difficulty": "medium",
    "critical": false,
    "split": "HOLDOUT",
    "origin": "synthetic_fixture"
  },
  {
    "question_id": "SYN-Q13",
    "intent_id": "FIX-INTENT-13",
    "leakage_group_id": "FIX-GROUP-13",
    "language": "de",
    "text": "Welche Identitäten haben die meisten erfassten Jahre, inklusive Gleichstand?",
    "category": "ranking_ratio",
    "difficulty": "easy",
    "critical": false,
    "split": "TRAIN",
    "origin": "synthetic_fixture"
  },
  {
    "question_id": "SYN-Q14",
    "intent_id": "FIX-INTENT-14",
    "leakage_group_id": "FIX-GROUP-14",
    "language": "de",
    "text": "Wie hoch ist 2021 der Anteil verifiziert durchgeführter an allen erfassten Beobachtungen?",
    "category": "ranking_ratio",
    "difficulty": "medium",
    "critical": false,
    "split": "TRAIN",
    "origin": "synthetic_fixture"
  },
  {
    "question_id": "SYN-Q15",
    "intent_id": "FIX-INTENT-15",
    "leakage_group_id": "FIX-GROUP-15",
    "language": "de",
    "text": "Sortiere die Landesgruppen nach Zahl erfasster Ereignisjahre absteigend, bei Gleichstand nach Code.",
    "category": "ranking_ratio",
    "difficulty": "medium",
    "critical": false,
    "split": "TEST",
    "origin": "synthetic_fixture"
  },
  {
    "question_id": "SYN-Q16",
    "intent_id": "FIX-INTENT-16",
    "leakage_group_id": "FIX-GROUP-16",
    "language": "de",
    "text": "Wie hoch ist der Anteil gelisteter Beobachtungen mit bekanntem Durchführungsstatus?",
    "category": "ranking_ratio",
    "difficulty": "medium",
    "critical": false,
    "split": "HOLDOUT",
    "origin": "synthetic_fixture"
  },
  {
    "question_id": "SYN-Q17",
    "intent_id": "FIX-INTENT-17",
    "leakage_group_id": "FIX-GROUP-17",
    "language": "de",
    "text": "Wie viele Beobachtungen haben unbekannten Durchführungsstatus?",
    "category": "missingness",
    "difficulty": "easy",
    "critical": true,
    "split": "TRAIN",
    "origin": "synthetic_fixture"
  },
  {
    "question_id": "SYN-Q18",
    "intent_id": "FIX-INTENT-18",
    "leakage_group_id": "FIX-GROUP-18",
    "language": "de",
    "text": "Wie viele sind explizit als nicht durchgeführt erfasst?",
    "category": "missingness",
    "difficulty": "medium",
    "critical": true,
    "split": "TRAIN",
    "origin": "synthetic_fixture"
  },
  {
    "question_id": "SYN-Q19",
    "intent_id": "FIX-INTENT-19",
    "leakage_group_id": "FIX-GROUP-19",
    "language": "de",
    "text": "Ist die Durchführung von SYN-1 im Jahr 2022 bekannt? Gib den gespeicherten Wert aus.",
    "category": "missingness",
    "difficulty": "medium",
    "critical": true,
    "split": "TEST",
    "origin": "synthetic_fixture"
  },
  {
    "question_id": "SYN-Q20",
    "intent_id": "FIX-INTENT-20",
    "leakage_group_id": "FIX-GROUP-20",
    "language": "de",
    "text": "Belegt die fehlende Zeile für SYN-3 2022 eine dauerhafte Einstellung?",
    "category": "missingness",
    "difficulty": "medium",
    "critical": true,
    "split": "HOLDOUT",
    "origin": "synthetic_fixture"
  },
  {
    "question_id": "SYN-Q21",
    "intent_id": "FIX-INTENT-21",
    "leakage_group_id": "FIX-GROUP-21",
    "language": "de",
    "text": "Welche Evidenz stützt die Durchführung von SYN-1 2021?",
    "category": "scope_provenance",
    "difficulty": "easy",
    "critical": true,
    "split": "TRAIN",
    "origin": "synthetic_fixture"
  },
  {
    "question_id": "SYN-Q22",
    "intent_id": "FIX-INTENT-22",
    "leakage_group_id": "FIX-GROUP-22",
    "language": "de",
    "text": "Wie viele Triathlons fanden 2023 in ganz Deutschland statt?",
    "category": "scope_provenance",
    "difficulty": "medium",
    "critical": true,
    "split": "TRAIN",
    "origin": "synthetic_fixture"
  },
  {
    "question_id": "SYN-Q23",
    "intent_id": "FIX-INTENT-23",
    "leakage_group_id": "FIX-GROUP-23",
    "language": "de",
    "text": "Beweist dieser Datensatz eine kausale Wirkung einer bundesweiten Regeländerung?",
    "category": "scope_provenance",
    "difficulty": "medium",
    "critical": true,
    "split": "TEST",
    "origin": "synthetic_fixture"
  },
  {
    "question_id": "SYN-Q24",
    "intent_id": "FIX-INTENT-24",
    "leakage_group_id": "FIX-GROUP-24",
    "language": "de",
    "text": "Welche Kalender- und Durchführungsabdeckung ist für DE-SH 2022 dokumentiert?",
    "category": "scope_provenance",
    "difficulty": "medium",
    "critical": true,
    "split": "HOLDOUT",
    "origin": "synthetic_fixture"
  }
]
